<?xml version="1.0" encoding="UTF-8"?>
<canciones xmlns:xsi="http://www.w3.org/2001/XMLSchema-instance" xsi:noNamespaceSchemaLocation="tarefa5.xsd">
    <cancion anho="2019" duracion="00:03:52">
        <compositores>
            <compositor>Israel B</compositor>
        </compositores>
        <productores>
            <productor>$kyhook</productor>
        </productores>
        <titulo>Concorde</titulo>
        <sello>inner_cut</sello>
        <artista pais_de_origen="EspaÃ±a">Israel B</artista>
        <publicacion publicada="Si"/>
    </cancion>
    <cancion anho="2020" duracion="00:04:37">
        <artista>Chico Blanco</artista>
        <titulo>Positif siempre</titulo>
        <compositores>
            <compositor>Chico Blanco</compositor>
        </compositores>
        <productores>
        </productores>
        <sello>thegroovesound</sello>
        <publicacion publicada="Si"/>
    </cancion>
</canciones>